{
  "anchor_id": "anchor_landscape",
  "aspect_ratio": "1:1",
  "date": "2026-08-13",
  "id": "obs_0020",
  "image_path": "artifacts/studies/study_optical_softness_001/anchor_landscape_high.jpg",
  "intended_level": "high",
  "intended_vector_id": "vec_optical_softness",
  "model": "grok-imagine",
  "notes": "Intended optical softness high. High pole looks like shallow focus plus bloom, not only optical melt.",
  "prompt": "Preserve the same subject, identity, pose, framing, crop, camera position, and key-light direction. Do not change wardrobe, props, or scene content. Do not restyle the picture into a period look, a movie still, or a genre.  Change only optical softness. Set optical softness to: heavy optical softness, melted fine detail, diffused highlight cores, lens-like bloom of definition. Do not add grain, do not change color grade, do not change lighting ratio, and do not add colored highlight bleed.",
  "scores": [
    {
      "confidence": 0.78,
      "method": "agent_visual",
      "score": 0.84,
      "vector_id": "vec_optical_softness"
    },
    {
      "confidence": 0.7,
      "method": "agent_visual",
      "score": 0.74,
      "vector_id": "vec_edge_softness"
    },
    {
      "confidence": 0.66,
      "method": "agent_visual",
      "score": 0.18,
      "vector_id": "vec_microcontrast"
    },
    {
      "confidence": 0.55,
      "method": "agent_visual",
      "score": 0.38,
      "vector_id": "vec_diffusion"
    },
    {
      "confidence": 0.6,
      "method": "agent_visual",
      "score": 0.08,
      "vector_id": "vec_halation"
    },
    {
      "confidence": 0.66,
      "method": "agent_visual",
      "score": 0.5,
      "vector_id": "vec_highlight_bloom"
    },
    {
      "confidence": 0.7,
      "method": "agent_visual",
      "score": 0.58,
      "vector_id": "vec_bokeh_softness"
    },
    {
      "confidence": 0.5,
      "method": "agent_visual",
      "score": 0.28,
      "vector_id": "vec_shadow_density"
    },
    {
      "confidence": 0.45,
      "method": "agent_visual",
      "score": 0.22,
      "vector_id": "vec_black_level"
    },
    {
      "confidence": 0.45,
      "method": "agent_visual",
      "score": 0.28,
      "vector_id": "vec_key_to_fill_ratio"
    },
    {
      "confidence": 0.4,
      "method": "agent_visual",
      "score": 0.3,
      "vector_id": "vec_source_hardness"
    },
    {
      "confidence": 0.45,
      "method": "agent_visual",
      "score": 0.51,
      "vector_id": "vec_highlight_rolloff"
    }
  ],
  "seed": null,
  "settings": {
    "hold_constant": [
      "subject identity",
      "pose and blocking",
      "framing and crop",
      "camera height and distance",
      "key light direction",
      "scene content",
      "source image when editing",
      "Do not add grain, do not change color grade, do not change lighting ratio, and do not add colored highlight bleed."
    ],
    "job_id": "job_study_optical_softness_001_landscape_high",
    "seed_control": "unavailable",
    "tool": "image_edit"
  },
  "source_image": "artifacts/anchors/anchor_landscape.jpg",
  "source_type": "generated",
  "study_id": "study_optical_softness_001",
  "unintended_changes": [
    "tilt-shift / DOF pattern",
    "invented sun glints on water"
  ]
}
