{
  "anchor_id": "anchor_landscape",
  "aspect_ratio": "1:1",
  "date": "2026-08-13",
  "id": "obs_0047",
  "image_path": "artifacts/studies/study_halation_001/anchor_landscape_high.jpg",
  "intended_level": "high",
  "intended_vector_id": "vec_halation",
  "model": "grok-imagine",
  "notes": "Intended halation high. Became a sunset, not local highlight bleed.",
  "prompt": "Preserve the same subject, identity, pose, framing, crop, camera position, and key-light direction. Do not change wardrobe, props, or scene content. Do not restyle the picture into a period look, a movie still, or a genre.  Change only halation. Set halation to: strong film-like halation, bright edges bleed into neighboring shadows, warm halo around lights. Do not globally soften the image, do not add grain, do not crush the whole tone scale, and do not change the subject's materials.",
  "scores": [
    {
      "confidence": 0.5,
      "method": "agent_visual",
      "score": 0.45,
      "vector_id": "vec_halation"
    },
    {
      "confidence": 0.74,
      "method": "agent_visual",
      "score": 0.78,
      "vector_id": "vec_highlight_bloom"
    },
    {
      "confidence": 0.55,
      "method": "agent_visual",
      "score": 0.31,
      "vector_id": "vec_optical_softness"
    },
    {
      "confidence": 0.5,
      "method": "agent_visual",
      "score": 0.16,
      "vector_id": "vec_edge_softness"
    },
    {
      "confidence": 0.48,
      "method": "agent_visual",
      "score": 0.58,
      "vector_id": "vec_microcontrast"
    },
    {
      "confidence": 0.45,
      "method": "agent_visual",
      "score": 0.26,
      "vector_id": "vec_diffusion"
    },
    {
      "confidence": 0.45,
      "method": "agent_visual",
      "score": 0.3,
      "vector_id": "vec_shadow_density"
    },
    {
      "confidence": 0.4,
      "method": "agent_visual",
      "score": 0.22,
      "vector_id": "vec_black_level"
    },
    {
      "confidence": 0.4,
      "method": "agent_visual",
      "score": 0.28,
      "vector_id": "vec_key_to_fill_ratio"
    },
    {
      "confidence": 0.4,
      "method": "agent_visual",
      "score": 0.3,
      "vector_id": "vec_source_hardness"
    },
    {
      "confidence": 0.35,
      "method": "agent_visual",
      "score": 0.08,
      "vector_id": "vec_bokeh_softness"
    },
    {
      "confidence": 0.45,
      "method": "agent_visual",
      "score": 0.54,
      "vector_id": "vec_highlight_rolloff"
    },
    {
      "confidence": 0.55,
      "method": "agent_visual",
      "score": 0.55,
      "vector_id": "vec_highlight_color_bias"
    }
  ],
  "seed": null,
  "settings": {
    "hold_constant": [
      "subject identity",
      "pose and blocking",
      "framing and crop",
      "camera height and distance",
      "key light direction",
      "scene content",
      "source image when editing",
      "Do not globally soften the image, do not add grain, do not crush the whole tone scale, and do not change the subject's materials."
    ],
    "job_id": "job_study_halation_001_landscape_high",
    "seed_control": "unavailable",
    "tool": "image_edit"
  },
  "source_image": "artifacts/anchors/anchor_landscape.jpg",
  "source_type": "generated",
  "study_id": "study_halation_001",
  "unintended_changes": [
    "invented sun disc",
    "time-of-day / grade change"
  ]
}
