{
  "anchor_id": "anchor_character",
  "aspect_ratio": "1:1",
  "date": "2026-08-13",
  "id": "obs_0084",
  "image_path": "artifacts/studies/study_diffusion_001/anchor_character_medium.jpg",
  "intended_level": "medium",
  "intended_vector_id": "vec_diffusion",
  "model": "grok-imagine",
  "notes": "Intended diffusion medium.",
  "prompt": "Preserve the same subject, identity, pose, framing, crop, camera position, and key-light direction. Do not change wardrobe, props, or scene content. Do not restyle the picture into a period look, a movie still, or a genre.  Change only diffusion. Set diffusion to: mild diffusion filter, slight scattering veil, modest contrast lift in the blacks. Change only the scattering veil. Do not defocus the subject, do not add circular bokeh orbs on in-focus surfaces, do not glow the eyes, do not change lighting direction, do not change time of day, do not add grain, and do not restyle into a genre.",
  "scores": [
    {
      "confidence": 0.58,
      "method": "agent_visual",
      "score": 0.26,
      "vector_id": "vec_optical_softness"
    },
    {
      "confidence": 0.52,
      "method": "agent_visual",
      "score": 0.21,
      "vector_id": "vec_edge_softness"
    },
    {
      "confidence": 0.76,
      "method": "agent_visual",
      "score": 0.42,
      "vector_id": "vec_diffusion"
    },
    {
      "confidence": 0.5,
      "method": "agent_visual",
      "score": 0.1,
      "vector_id": "vec_bokeh_softness"
    },
    {
      "confidence": 0.5,
      "method": "agent_visual",
      "score": 0.6,
      "vector_id": "vec_microcontrast"
    },
    {
      "confidence": 0.5,
      "method": "agent_visual",
      "score": 0.06,
      "vector_id": "vec_halation"
    },
    {
      "confidence": 0.5,
      "method": "agent_visual",
      "score": 0.08,
      "vector_id": "vec_highlight_bloom"
    },
    {
      "confidence": 0.55,
      "method": "agent_visual",
      "score": 0.25,
      "vector_id": "vec_veiling_glare"
    },
    {
      "confidence": 0.4,
      "method": "agent_visual",
      "score": 0.28,
      "vector_id": "vec_shadow_density"
    },
    {
      "confidence": 0.5,
      "method": "agent_visual",
      "score": 0.3,
      "vector_id": "vec_black_level"
    },
    {
      "confidence": 0.35,
      "method": "agent_visual",
      "score": 0.28,
      "vector_id": "vec_key_to_fill_ratio"
    },
    {
      "confidence": 0.35,
      "method": "agent_visual",
      "score": 0.3,
      "vector_id": "vec_source_hardness"
    },
    {
      "confidence": 0.35,
      "method": "agent_visual",
      "score": 0.35,
      "vector_id": "vec_highlight_rolloff"
    }
  ],
  "seed": null,
  "settings": {
    "hold_constant": [
      "subject identity",
      "pose and blocking",
      "framing and crop",
      "camera height and distance",
      "key light direction",
      "scene content",
      "source image when editing",
      "Change only the scattering veil. Do not defocus the subject, do not add circular bokeh orbs on in-focus surfaces, do not glow the eyes, do not change lighting direction, do not change time of day, do not add grain, and do not restyle into a genre."
    ],
    "job_id": "job_study_diffusion_001_character_medium",
    "seed_control": "unavailable",
    "tool": "image_edit"
  },
  "source_image": "artifacts/anchors/anchor_character.jpg",
  "source_type": "generated",
  "study_id": "study_diffusion_001",
  "unintended_changes": []
}
