{
  "anchor_id": "anchor_lamp_landscape",
  "aspect_ratio": "1:1",
  "date": "2026-08-14",
  "id": "obs_0148",
  "image_path": "artifacts/anchors/anchor_lamp_landscape.jpg",
  "intended_level": "baseline",
  "intended_vector_id": null,
  "model": "grok-imagine",
  "notes": "Lamp-present lock. Visible practical confirmed. Baseline scores for the locked anchor.",
  "prompt": "A night coastal path along a grassy cliff, dark sea beyond, no people. One tall street lamp already in frame beside the path, its warm bulb visible, lighting the near grass. Clear night air. Clean contemporary landscape: natural night color, moderate contrast, sharp focus, no film effects, no extra glow, no added haze, no grain. 35mm-equivalent, eye-level, square 1:1 frame.",
  "scores": [
    {
      "confidence": 0.72,
      "method": "agent_visual",
      "score": 0.18,
      "vector_id": "vec_optical_softness"
    },
    {
      "confidence": 0.68,
      "method": "agent_visual",
      "score": 0.16,
      "vector_id": "vec_edge_softness"
    },
    {
      "confidence": 0.7,
      "method": "agent_visual",
      "score": 0.64,
      "vector_id": "vec_microcontrast"
    },
    {
      "confidence": 0.6,
      "method": "agent_visual",
      "score": 0.08,
      "vector_id": "vec_diffusion"
    },
    {
      "confidence": 0.7,
      "method": "agent_visual",
      "score": 0.04,
      "vector_id": "vec_halation"
    },
    {
      "confidence": 0.66,
      "method": "agent_visual",
      "score": 0.06,
      "vector_id": "vec_highlight_bloom"
    },
    {
      "confidence": 0.55,
      "method": "agent_visual",
      "score": 0.1,
      "vector_id": "vec_bokeh_softness"
    },
    {
      "confidence": 0.68,
      "method": "agent_visual",
      "score": 0.3,
      "vector_id": "vec_shadow_density"
    },
    {
      "confidence": 0.6,
      "method": "agent_visual",
      "score": 0.22,
      "vector_id": "vec_black_level"
    },
    {
      "confidence": 0.58,
      "method": "agent_visual",
      "score": 0.28,
      "vector_id": "vec_key_to_fill_ratio"
    },
    {
      "confidence": 0.55,
      "method": "agent_visual",
      "score": 0.32,
      "vector_id": "vec_source_hardness"
    },
    {
      "confidence": 0.5,
      "method": "agent_visual",
      "score": 0.35,
      "vector_id": "vec_highlight_rolloff"
    }
  ],
  "seed": null,
  "settings": {
    "hold_constant": [],
    "job_id": "job_lamp_landscape",
    "seed_control": "unavailable",
    "tool": "image_gen"
  },
  "source_image": null,
  "source_type": "generated",
  "study_id": "study_lamp_anchor_set_001",
  "unintended_changes": []
}
